### ISSUE TITLE
Timeout waiting for SSH

### ISSUE THREAD

**Issue by rjosephwright** [mitchellh/packer#2333]
Packer log: https://gist.github.com/rjosephwright/d0257fba61ae7795b37d
Config: https://gist.github.com/rjosephwright/16722edd70ac4ee313da

I am unable to create any images using the amazon-ebs builder due to an error "Timeout waiting for SSH". I am running 0.8.0 on Ubuntu 15.04, although I have tried with 0.7.5 (previously working for me) and get the same failure.

During the time that packer's log reports "handshaking with SSH", I can manually log into the very same instance from the command line without any issues, using both the IP and the DNS name. It is not an issue with `ssh_username`. I have tried using `ssh_keypair_name` and `ssh_private_key_file` options with known good values and still get the same result.

**Comment by rjosephwright** [comment]
I have added tcpdump output here: https://gist.github.com/rjosephwright/61d18171c827de370862

At `09:59:56.321622` the ec2 instance becomes reachable, however RST ACK packets are being returned continuously in response to SYN packets, until `10:01:21.622795` where the three way handshake finally occurs. But then a FIN ACK from the local machine immediately afterwards. It's just strange that this same behavior doesn't happen from a command line ssh connection.

**Comment by mitchellh** [comment]
So it looks like somehow it can hang on the handshake step, and it appears that the SSH library that Go provides doesn't have any option for setting a timeout on this. I think we need to make a jank timeout mechanism to fix this...

**Comment by cbednarski** [comment]
@rjosephwright Is this happening every time or only occasionally? Also can you double-check the config you linked is the one you're using? You mention using Ubuntu 15.04 but your config uses yum install -- just want to make sure I'm looking at the right stuff before I head down the rabbit hole.

**Comment by rjosephwright** [comment]
Hi @cbednarski, it is happening every time on my local machine which is running Ubuntu. The yum command is for the destination ec2 instance running Amazon Linux.

Also, I did more test runs with tcpdump and it seems the RST ACK responses are normal as those happen during the time that Amazon makes the instance's public IP available but before the instance has finished booting, so there is not yet an ssh daemon to connect to. So I believe the problem happens right after the three way handshake.

**Comment by cbednarski** [comment]
@rjosephwright I've wrapped the SSH handshake in retry logic but since I cannot repro I don't have a way to test this. If you're able to build this would you be willing to test it out?

```
go get -u github.com/mitchellh/packer
cd $GOPATH/src/github.com/mitchellh/packer/
make updatedeps
git checkout b-ssh-retry
make dev
PACKER_LOG=1 $GOPATH/src/github.com/mitchellh/packer/bin/packer build your-template.json
```

**Comment by rjosephwright** [comment]
@cbednarski It works!

```
2015/06/30 13:23:24 packer-builder-amazon-ebs: 2015/06/30 13:23:24 [INFO] Attempting SSH connection...
2015/06/30 13:23:24 packer-builder-amazon-ebs: 2015/06/30 13:23:24 reconnecting to TCP connection for SSH
2015/06/30 13:23:24 packer-builder-amazon-ebs: 2015/06/30 13:23:24 Handshaking with SSH
2015/06/30 13:23:24 packer-builder-amazon-ebs: 2015/06/30 13:23:24 3 handshake attempt(s) left
2015/06/30 13:23:26 packer-builder-amazon-ebs: 2015/06/30 13:23:26 Handshake complete!
2015/06/30 13:23:26 packer-builder-amazon-ebs: 2015/06/30 13:23:26 opening new ssh session
2015/06/30 13:23:27 packer-builder-amazon-ebs: 2015/06/30 13:23:27 [INFO] agent forwarding enabled
2015/06/30 13:23:27 ui: ==> amazon-ebs: Connected to SSH!
2015/06/30 13:23:27 packer-builder-amazon-ebs: 2015/06/30 13:23:27 Running the provision hook
==> amazon-ebs: Connected to SSH!
2015/06/30 13:23:27 ui: ==> amazon-ebs: Provisioning with shell script: /tmp/packer-shell198455656
```

```
13:23:24.448958 IP local_machine.56287 > remote_machine.22: Flags [S], seq 2804365480, win 29200, options [mss 1460,sackOK,TS val 87467657 ecr 0,nop,wscale 7], length 0
13:23:24.597835 IP remote_machine.22 > local_machine.56287: Flags [S.], seq 4273363096, ack 2804365481, win 26847, options [mss 8961,sackOK,TS val 4294915823 ecr 87467657,nop,wscale 7], length 0
13:23:24.597906 IP local_machine.56287 > remote_machine.22: Flags [.], ack 1, win 229, options [nop,nop,TS val 87467694 ecr 4294915823], length 0
13:23:24.598079 IP local_machine.56287 > remote_machine.22: Flags [F.], seq 1, ack 1, win 229, options [nop,nop,TS val 87467694 ecr 4294915823], length 0
13:23:24.598271 IP local_machine.56288 > remote_machine.22: Flags [S], seq 1809528868, win 29200, options [mss 1460,sackOK,TS val 87467694 ecr 0,nop,wscale 7], length 0
13:23:24.744684 IP remote_machine.22 > local_machine.56288: Flags [S.], seq 2653325236, ack 1809528869, win 26847, options [mss 8961,sackOK,TS val 4294915860 ecr 87467694,nop,wscale 7], length 0
13:23:24.744753 IP local_machine.56288 > remote_machine.22: Flags [.], ack 1, win 229, options [nop,nop,TS val 87467731 ecr 4294915860], length 0
13:23:24.745001 IP local_machine.56288 > remote_machine.22: Flags [P.], seq 1:13, ack 1, win 229, options [nop,nop,TS val 87467731 ecr 4294915860], length 12
13:23:24.746839 IP remote_machine.22 > local_machine.56287: Flags [.], ack 2, win 210, options [nop,nop,TS val 4294915861 ecr 87467694], length 0
```

**Comment by rjosephwright** [comment]
Thanks for your help and such a quick response @mitchellh and @cbednarski.

**Comment by qwcode** [comment]
this should be reopened.   the refererenced PR is not going to be merged
